{
  "schemaVersion": 1,
  "id": "bobocloud.document-preview",
  "version": "1.0.1",
  "publishedAt": "2026-08-24T01:22:57+08:00",
  "engines": {
    "bobocloud": ">=2.6.1 <3.0.0",
    "pluginApi": "^1.3.0"
  },
  "artifact": {
    "format": "boboplugin",
    "url": "https://raw.githubusercontent.com/NemophilistJohn/bobocloud-document-preview/v1.0.1/artifacts/bobocloud.document-preview-1.0.1.boboplugin",
    "sha256": "8b30ec9bababdd3d978203a84f1d0f1f4a40af1348291e8179e4401d8fb23919",
    "size": 625460
  },
  "source": {
    "repository": "https://github.com/NemophilistJohn/bobocloud-document-preview",
    "ref": "v1.0.1"
  },
  "permissions": [
    "documentViews.register",
    "documents.read"
  ],
  "locales": [
    "en",
    "zh-CN",
    "ja"
  ]
}
