{
  "schemaVersion": 1,
  "id": "bobocloud.ai-agent",
  "version": "1.1.0",
  "publishedAt": "2026-08-25T03:19:11+08:00",
  "engines": {
    "bobocloud": ">=2.8.0 <3.0.0",
    "pluginApi": "^1.5.0"
  },
  "artifact": {
    "format": "boboplugin",
    "url": "https://raw.githubusercontent.com/NemophilistJohn/BOBOCloud-AI-Agent-plugin-offical/v1.1.0/artifacts/bobocloud.ai-agent-1.1.0.boboplugin",
    "sha256": "5de2eb8787e7026af005b2f0e761ab6253d5a699de33b8bd7514158fdc753bb9",
    "size": 18848
  },
  "source": {
    "repository": "https://github.com/NemophilistJohn/BOBOCloud-AI-Agent-plugin-offical",
    "ref": "v1.1.0"
  },
  "permissions": [
    "commands.register",
    "agents.register",
    "models.generate",
    "workspace.read",
    "workspace.write",
    "process.execute",
    "skills.read",
    "storage.local"
  ],
  "locales": [
    "en",
    "zh-CN",
    "ja"
  ]
}
